Spanish word,English word,Spanish Sentence,English Sentence
alto,loud,"El semáforo cambió a rojo, así que los conductores tuvieron que detenerse en el alto.","The traffic light changed to red, so the drivers had to come to a stop at the intersection."
bajo,soft,El gato duerme bajo la mesa.,"""The cat sleeps under the table."""
ensordecedor,deafening,El ensordecedor ruido de la sirena me asustó mucho.,The deafening noise of the siren frightened me a lot.
agudo,"sharp, high-pitched",El olor agudo de las especias llenaba la cocina.,The sharp smell of spices filled the kitchen.
grave,low-pitched,El médico dijo que la enfermedad de la paciente es grave.,The doctor said that the patient's illness is serious.
melodioso,melodious,La voz del cantante era melodiosa y cautivó a todos los presentes.,The singer's voice was melodious and captivated everyone in attendance.
armónico,harmonic,La música en este concierto es muy armónica y relajante.,The music at this concert is very harmonic and relaxing.
zumbido,buzz,El zumbido de las abejas se escuchaba en el jardín.,The buzzing of the bees could be heard in the garden.
sordo,deaf,El hombre sordo utilizó el lenguaje de señas para comunicarse con los demás.,The deaf man used sign language to communicate with others.
duro de oíd,hard of hearing,"Claro, aquí tienes: A veces es difícil comunicarse con él, es un poco duro de oído.","Of course, here you go: Sometimes it's hard to communicate with him, he's a bit hard of hearing."
oído fino,acute hearing,Mi abuela tiene un oído fino para la música clásica.,"""My grandmother has a keen ear for classical music."""
problemas de audición,hearing-impaired,Los problemas de audición pueden afectar la calidad de vida de una persona.,Hearing problems can impact a person's quality of life.
fuera de alcance,out of earshot,El objeto estaba fuera de alcance y no pude alcanzarlo.,The object was out of reach and I couldn't reach it.
ver,to see,Voy a ver una película esta noche.,I'm going to watch a movie tonight.
mirar,to look,Clara estaba mirando las estrellas en el cielo nocturno.,Clara was gazing at the stars in the night sky.
de colores,colorful,Los globos decorativos son de colores brillantes y hermosos.,The decorative balloons are bright and beautiful colors.
blanco y negro,black and white,El arte de fotografía se distingue por sus imágenes en blanco y negro.,The art of photography is distinguished by its black and white images.
brillante,bright,El sol brillante iluminaba el paisaje en la mañana.,The bright sun illuminated the landscape in the morning.
apagado,dim,El televisor está apagado porque nadie lo está viendo.,"""The television set is turned off because no one is watching it."""
claro,light,"¡Por supuesto! ""Claro que quiero ayudarte en lo que necesites.""","""¡Por supuesto! Claro que quiero ayudarte en lo que necesites,"" she said with a warm smile."
oscuro,dark,El bosque estaba tan oscuro que apenas podíamos ver por dónde íbamos.,The forest was so dark that we could barely see where we were going.
ciego,blind,El ciego utilizaba un bastón para desplazarse por la ciudad.,The blind man used a cane to move around the city.
mirar fijamente,to stare,Clara miraba fijamente el paisaje desde la montaña.,Clara was staring fixedly at the landscape from the mountain.
echar un vistazo,to glance,"Por favor, echa un vistazo a mi informe antes de la reunión.","""Please take a look at my report before the meeting."""
bizquear,to squint,La luz intensa me hace bizquear cuando salgo al sol.,The intense light makes me squint when I go out in the sun.
guiñar,to wink,¡Le guiñó el ojo a su amigo para indicarle que todo iba según lo planeado!,He winked at his friend to indicate that everything was going according to plan!
parpadear,to blink,"""Me gusta mirar las estrellas y parpadear rápidamente cuando veo una estrella fugaz.""","""I like to watch the stars and blink quickly when I see a shooting star."""
tocar,to touch,Voy a aprender a tocar la guitarra este verano.,"""Voy a aprender a tocar la guitarra este verano para poder sorprender a mis amigos con mi talento musical."""
agarrar,to grab,¡No te olvides de agarrar tu paraguas antes de salir de casa!,Don't forget to grab your umbrella before leaving the house!
suave,soft,El gato acariciaba con movimientos suaves.,The cat was gently stroking with soft movements.
áspero(a),rough,La superficie de la piedra era áspera al tacto.,The surface of the stone was rough to the touch.
liso(a),smooth,Ella tiene el cabello muy liso y brillante.,She has very straight and shiny hair.
rugoso(a),wrinkled,La textura de la corteza de algunos árboles es rugosa.,The texture of the bark of some trees is rough.
pegajoso(a),sticky,La salsa de tomate estaba muy pegajosa después de que se derramara en la mesa.,The tomato sauce was very sticky after it spilled on the table.
punzante,sharp,El dolor punzante en mi espalda no me permitía moverme con facilidad.,"""The sharp pain in my back made it difficult for me to move easily."""
sedoso(a),silky,El gatito tiene un pelaje sedoso y suave.,The little kitten has a silky and soft fur.
esponjoso(a),spongy,El pastel de chocolate es esponjoso y delicioso.,The chocolate cake is fluffy and delicious.
mullido(a),fluffy,El colchón nuevo es muy mullido y cómodo para dormir.,The new mattress is very soft and comfortable to sleep on.
hormigueo,tingle,El hormigueo en mi brazo es tan intenso que no puedo sentirlo.,The tingling in my arm is so intense that I can't feel it.
entumecido(a),numb,"Después de estar sentado(a) por tanto tiempo, mis piernas estaban entumecidas.","After sitting for so long, my legs were numb."
rozar,to touch gently,La mariposa rosó suavemente la flor con sus alas.,The butterfly gently touched the flower with its wings.
acariciar,to caress,La niña acarició su suave peluche antes de dormir.,"""The girl caressed her soft plush toy before going to sleep."""
agarrar,to grab,La niña tenía miedo de agarrar al pequeño gato negro.,"""The girl was afraid to pick up the little black cat."""
olor,smell,El olor a café recién hecho invadió la habitación.,The smell of freshly brewed coffee filled the room.
el perfume,scent,"Claro, aquí tienes: ""Me encantó el perfume que me regalaste.""","Of course, here you go: ""I absolutely loved the perfume you gave me."""
la fragancia,fragrance,Me encanta la fragancia de las rosas en el jardín.,I love the fragrance of the roses in the garden.
el hedor,stench,El hedor de la basura en la calle es insoportable.,"""The stench of the garbage in the street is unbearable."""
apestoso(a),smelly,¡El queso viejo tiene un olor apestoso pero un sabor delicioso!,The old cheese has a stinky smell but a delicious taste!
fresco(a),fresh,"¡Hoy hace mucho calor, así que es importante mantenerse fresco(a)!","Today is very hot, so it is important to stay cool!"
acre,pungent,El granjero compró una nueva acre de tierra para expandir su cultivo.,The farmer bought a new acre of land to expand his crops.
húmedo(a),musty,El clima en la selva tropical es muy húmedo durante todo el año.,The climate in the rainforest is very humid throughout the year.
podrido(a),rotten,La fruta en la canasta está podrida.,The fruit in the basket is rotten.
ahumado(a),smoky,El salmón ahumado es uno de mis platos favoritos.,Smoked salmon is one of my favorite dishes.
apestar,to stink,El olor a pescado en la cocina apesta.,The smell of fish in the kitchen stinks.
gusto,- taste,¡Es un gusto conocerte!,"""It's a pleasure to meet you!"""
sabor,flavor,El sabor de la comida mexicana es delicioso.,The taste of Mexican food is delicious.
probar,try,"Claro, aquí tienes: ""Voy a probar el nuevo restaurante que abrió en la esquina"".","""¡Claro, aquí tienes: 'Voy a probar el nuevo restaurante que abrió en la esquina.'!"""
sabroso,está sabrosa,¡Esta sopa está sabrosa!,"""This soup is flavorful!"""
delicioso,delicious,El pastel de chocolate estaba delicioso.,"""The chocolate cake was delicious."""
perfecto,perfect,¡El clima hoy es perfecto para ir a la playa!,The weather today is perfect for going to the beach!
apetitoso,appetizing,¡Ese pastel se ve muy apetitoso!,That cake looks very appetizing!
dulce,sweet,¡Me encanta el postre dulce que preparaste!,I love the sweet dessert you made!
dulzón,sugary,El postre estaba demasiado dulzón para mi gusto.,The dessert was too sweet for my taste.
soso,bland,"El pollo estaba soso, le faltaba sal y condimentos.","The chicken was bland, it lacked salt and seasonings."
abierto/a – open,,"La puerta está abierta, puedes entrar.","""The door is open, you can come in."""
ancho/a – wide,,El río es ancho y tranquilo.,"The river is wide and calm, perfect for a relaxing boat ride."
estrecho/a – narrow,,El pasillo del tren era muy estrecho y apenas cabía una persona a la vez.,"The train aisle was very narrow, and only one person could fit through at a time."
lejano/a – far,,La luna parece estar muy lejana en el cielo esta noche.,"""The moon seems to be very distant in the sky tonight."""
cercano/a – close,,La tienda está muy cercana a mi casa.,"""The store is very close to my house."""
alegre – joyful,,Mi abuela tiene una sonrisa alegre que ilumina la habitación.,My grandmother has a cheerful smile that lights up the room.
"gracioso/a – funny, amusing",,El payaso en la fiesta era muy gracioso y nos hizo reír mucho.,The clown at the party was very funny and made us laugh a lot.
serio/a – serious,,La situación era muy seria y requería nuestra atención inmediata.,The situation was very serious and required our immediate attention.
tímido/a – shy,,El estudiante nuevo es muy tímido y le cuesta hacer amigos.,"""The new student is very shy and finds it difficult to make friends."""
valiente – brave,,El soldado demostró ser valiente durante la batalla.,The soldier proved to be brave during the battle.
loco/a – crazy,,¡Ese payaso es tan loco que siempre nos hace reír!,"""That clown is so crazy that he always makes us laugh!"""
contento(a),content,Clara estaba contenta porque aprobó el examen.,Clara was happy because she passed the exam.
feliz,happy,¡Estoy muy feliz de estar aquí ayudándote!,"""I am very happy to be here helping you!"""
preocupado(a),worried,Estoy preocupado(a) por mi examen de mañana.,I am worried about my exam tomorrow.
nervioso(a),nervous,Clara estaba nerviosa antes de su presentación en público.,Clara was nervous before her public presentation.
tranquilo(a),tranquil,¡Estoy tranquila en mi hogar leyendo un buen libro!,I am calm at home reading a good book!
calmado(a),calm,El maestro hablaba con voz calmada para tranquilizar a los estudiantes nerviosos antes del examen.,The teacher spoke with a calm voice to reassure the nervous students before the exam.
emocionado(a),excited,¡Estoy emocionada por la próxima aventura que vamos a vivir juntos!,"""I am excited for the next adventure that we are going to experience together!"""
largo/a,long,La fila para entrar al concierto era muy larga.,The line to enter the concert was very long.
corto/a,short,El vestido que compré es demasiado corto.,"""The dress that I bought is too short."""
liso/a,straight,El cabello de María es muy liso y brillante.,Maria's hair is very straight and shiny.
rizado/a,curly,Su cabello rizado le otorgaba un aspecto único y lleno de estilo.,Her curly hair gave her a unique and stylish look.
ondulado/a,wavy,El cabello de María es naturalmente ondulado.,María's hair is naturally wavy.
castaño/a,brown,El caballo tiene un hermoso pelaje castaño.,The horse has a beautiful chestnut coat.
rubio/a,blonde,"El verano pasado, conocí a un chico rubio en la playa.","Last summer, I met a blond guy at the beach."
pelirrojo/a,red,El chico pelirrojo tiene pecas en la cara.,The red-haired boy has freckles on his face.
negro/a,black,El gato negro cruzó la calle en la noche.,The black cat crossed the street at night.
canoso/a,grey,"Por lo general, las personas mayores suelen tener el cabello canoso.","""Generally, elderly people tend to have gray hair."""
abundante,thick,El río estaba lleno de agua abundante después de la lluvia.,"""The river was full of abundant water after the rain."""
fino/a,thin,¡El vino fino español es muy apreciado en todo el mundo!,Spanish fine wine is highly valued around the world!
escalado/a,layered,El monte fue escalado por un grupo de valientes alpinistas.,The mountain was climbed by a group of brave mountaineers.
teñido/a,dyed,La camiseta blanca quedó teñida de color rosa por accidente.,The white shirt got dyed pink by accident.
saludable,healthy,Es importante mantener una dieta balanceada y hacer ejercicio regularmente para llevar un estilo de vida saludable.,It is important to maintain a balanced diet and exercise regularly to lead a healthy lifestyle.
claro/a,light,¡Por supuesto! Claro que te puedo ayudar con eso.,¡Por supuesto! Claro que te puedo ayudar con eso. Just let me know what you need assistance with.
encrespado/a,frizzy,El viento fuerte hizo que el cabello de la chica se pusiera encrespado.,The strong wind made the girl's hair become frizzy.
brillante,shiny,El sol brillante ilumina el cielo azul.,"""The bright sun illuminates the blue sky."""
calvo/a,bald,El hombre calvo llevaba un sombrero para protegerse del sol.,The bald man wore a hat to protect himself from the sun.
grande – big,,El elefante tiene orejas grandes.,The elephant has large ears.
pequeño/a – small,,El gatito es muy pequeño y tierno.,The kitten is very small and adorable.
enorme – huge,,El elefante tenía unas orejas enormes.,The elephant had enormous ears.
delgado/a,lean,El vestido que llevaba era de un material muy fino y me hacía ver más delgada.,"""The dress I was wearing was made of a very fine material and it made me look slimmer."""
esbelto/a,slender,La modelo tenía una figura esbelta y elegante en la pasarela.,"""The model had a slender and elegant figure on the runway."""
flaco/a,skinny,Clara es una chica flaca y alta.,Clara is a tall and thin girl.
menudo/a,petite,¡Hoy comí un delicioso menudo en el almuerzo!,Today I ate a delicious menudo for lunch!
alto/a,tall,El árbol alto proporciona sombra en el parque.,"""The tall tree provides shade in the park."""
bajo/a,short,El gato duerme bajo la mesa.,"""The cat sleeps under the table."""
hermoso/a,beautiful,"Claro, aquí tienes una oración: ""El jardín del parque es hermoso en primavera.""","Of course, here is a sentence: ""The park garden is beautiful in spring."""
guapo/a,handsome,¡Ese chico es tan guapo que todas las chicas se enamoran de él!,That boy is so handsome that all the girls fall in love with him!
feo/a,ugly,La película que vi ayer era muy fea.,The movie I watched yesterday was very ugly.
adorable,cute,¡Ese cachorrito es tan adorable!,That puppy is so adorable!
bonita,pretty,¡Esa flor es muy bonita!,That flower is very beautiful!
impresionante,stunning,La vista desde la montaña es impresionante.,The view from the mountain is impressive.
poco atractivo/a,plain,El restaurante tenía un menú poco atractivo para los clientes.,The restaurant had an unappealing menu for the customers.
promedio/a,average,El promedio de edad de los estudiantes en la clase es de 20 años.,The average age of the students in the class is 20 years.
atractivo/a,attractive,El nuevo restaurante en el centro de la ciudad es muy atractivo y tiene una decoración excelente.,The new restaurant in the city center is very attractive and has excellent decor.
negro,black,El perro es negro y muy juguetón.,The dog is black and very playful.
marrón / café,brown,El oso de peluche es de color marrón.,The teddy bear is brown in color.
gris,grey,El cielo está gris y nublado hoy.,"""The sky is gray and cloudy today."""
blanco,white,El gato blanco persigue a la mariposa.,The white cat chases the butterfly.
amarillo,yellow,El sol brilla en un cielo amarillo.,The sun shines in a yellow sky.
anaranjado,orange,El sol se pone de un tono anaranjado al atardecer.,The sun turns a shade of orange at sunset.
rojo,red,El vestido que llevaba era de color rojo.,The dress she was wearing was red.
rosado,pink,El vestido que llevaba la niña era rosado y muy bonito.,The dress that the girl was wearing was pink and very beautiful.
morado / púrpura,purple,El vestido que compré para la fiesta es de un color morado brillante.,"""The dress I bought for the party is a bright purple color."""
azul,blue,El cielo está azul y despejado.,The sky is blue and clear today.
verde,green,El pasto en el jardín es muy verde.,"""The grass in the garden is very green."""
colorear,to color,A los niños les encanta colorear dibujos en sus cuadernos de actividades.,Children love coloring pictures in their activity notebooks.
construir,to construct,Voy a construir una casa en el campo.,I am going to build a house in the countryside.
cortar,to cut,Voy a cortar las verduras para la ensalada.,"""I am going to chop the vegetables for the salad."""
coser,to sew,Voy a coser un botón en mi camisa.,I am going to sew a button on my shirt.
dibujar,to draw,Me gusta mucho dibujar paisajes en mi tiempo libre.,I really enjoy drawing landscapes in my free time.
pintar,to paint,Voy a pintar un cuadro este fin de semana.,I'm going to paint a picture this weekend.
cero,zero,El equipo de fútbol perdió por cero goles a cero en el partido de hoy.,The soccer team lost by zero goals to zero in today's match.
uno,one,"Claro, aquí tienes: ""Uno de mis amigos cumplirá años la próxima semana.""","Of course, here you go: ""One of my friends will have their birthday next week."""
dos,two,Mañana tengo dos reuniones importantes en la oficina.,"""Tomorrow I have two important meetings at the office."""
tres,three,Hay tres gatos en el jardín.,There are three cats in the garden.
cuatro,four,El equipo de fútbol anotó cuatro goles durante el partido.,The soccer team scored four goals during the game.
cinco,five,Hoy es martes cinco de octubre.,"Today is Tuesday, the fifth of October."
seis,six,El juego de cartas tiene seis jugadores.,"""The card game has six players."""
siete,seven,El reloj marca las siete en punto.,"""The clock strikes seven on the dot."""
ocho,eight,El reloj marcó las ocho en punto.,The clock struck eight o'clock on the dot.
nueve,nine,La reunión comenzará a las nueve de la mañana. (The meeting will start at nine in the morning.),"La reunión comenzará a las nueve de la mañana, así que asegúrate de llegar a tiempo para no perderte ninguna información importante."
diez,ten,Él tiene diez años de edad.,He has ten years of age.
This animal vocab will help you talk about animals both on land and in the ocean!,,Este vocabulario de animales te ayudará a hablar sobre animales tanto en tierra como en el océano.,This animal vocabulary will help you talk about animals both on land and in the ocean.
el gato,cat,El gato negro cruzó la calle en la noche.,El gato negro cruzó la calle en la noche y desapareció en la oscuridad.
el perro,dog,El perro corre feliz en el parque.,The dog runs happily in the park.
el conejo,rabbit,El conejo saltó por el prado verde.,The rabbit jumped through the green meadow.
el pollo,chicken,Ayer cociné el pollo asado para la cena.,"Yesterday, I cooked roasted chicken for dinner."
la gallina,hen,La gallina puso un huevo en el nido.,The hen laid an egg in the nest.
el gallo,rooster,El gallo canta al amanecer.,"Sure! Here is a sentence for you: ""In the countryside, el gallo canta al amanecer, waking up everyone with its crowing."""
la vaca,cow,La vaca está pastando en el campo.,The cow is grazing in the field.
el toro,bull,El toro bravo embistió al matador en la plaza.,"""El toro bravo embistió al matador en la plaza"" translates to ""The brave bull charged at the bullfighter in the arena"" in English."
la oveja,sheep,La oveja blanca corre por el campo.,"""The white sheep runs through the field."""
el caballo,horse,El caballo galopaba libre y feliz por el prado.,The horse galloped freely and happily through the meadow.
el cerdo,pig,El cerdo es un animal que se cría principalmente para obtener carne.,The pig is an animal that is mainly raised to obtain meat.
la cabra,goat,La cabra se escapó del corral y ahora está pastando en el campo.,The goat escaped from the pen and is now grazing in the field.
el burro,donkey,El burro es un animal resistente y trabajador.,"""The donkey is a resilient and hardworking animal."""
el ratón,mouse,El ratón corre rápido por el campo.,The mouse runs fast through the field.
el ciervo,deer,El ciervo corre velozmente por el bosque en busca de alimento.,The deer runs swiftly through the forest in search of food.
el mapache,raccoon,El mapache es un animal nocturno y astuto que habita en América.,The raccoon is a nocturnal and cunning animal that inhabits America.
la ardilla -,squirrel,La ardilla saltó de rama en rama en busca de nueces.,The squirrel jumped from branch to branch in search of nuts.
el búho,owl,El búho es un ave nocturna que simboliza la sabiduría en muchas culturas.,The owl is a nocturnal bird that symbolizes wisdom in many cultures.
el zorro,fox,El zorro es un astuto animal que vive en los bosques.,"""The fox is a cunning animal that lives in the forests."""
el lobo,wolf,El lobo aúlla en la oscuridad de la noche.,"""The wolf howls in the darkness of the night."""
el oso,bear,El oso pardo es un animal grande y fuerte que habita en los bosques.,"""The brown bear is a large and strong animal that lives in the forests."""
el cangrejo,crab,El cangrejo se escondió debajo de una roca en la playa.,The crab hid under a rock on the beach.
la medusa,jellyfish,La medusa de agua-viva es una criatura marina fascinante.,The jellyfish is a fascinating marine creature.
el delfín,dolphin,El delfín es un mamífero marino muy inteligente y juguetón.,The dolphin is a very intelligent and playful marine mammal.
la ballena,whale,¡En el océano pacífico vi a la ballena nadando tranquilamente!,"In the Pacific Ocean, I saw the whale swimming peacefully!"
el tiburón,shark,El tiburón nada en el mar.,The shark swims in the sea.
la foca,seal,La foca es un mamífero marino que vive en el océano.,The seal is a marine mammal that lives in the ocean.
el lobo marino,sea lion,El lobo marino descansaba en la playa bajo el sol.,The sea lion was resting on the beach under the sun.
la morsa,walrus,La morsa es un animal marino muy grande y poderoso.,The walrus is a very large and powerful marine animal.
el pingüino,penguin,El pingüino es un animal que vive en los climas fríos de la Antártida.,The penguin is an animal that lives in the cold climates of Antarctica.
el viaje,trip,Disfrutamos mucho de el viaje que hicimos a la playa el verano pasado.,"""We really enjoyed the trip we took to the beach last summer."""
el equipaje,bags,El equipaje está listo para nuestro viaje de vacaciones.,"""The luggage is ready for our holiday trip."""
la salida,exit,La salida del edificio está en la parte trasera.,The exit of the building is at the back.
la llegada,arrival,La llegada de mi familia al aeropuerto fue emocionante.,The arrival of my family at the airport was exciting.
los documentos de identidad,id papers,Necesitas llevar los documentos de identidad para poder viajar internacionalmente.,You need to bring your identification documents in order to travel internationally.
el billete de avión,boarding pass,Necesito comprar el billete de avión para mi viaje a España.,I need to buy the plane ticket for my trip to Spain.
el hotel,hotel,"Claro, aquí tienes una oración: ""El hotel donde nos hospedamos durante las vacaciones era muy lujoso y cómodo.""","Claro, here is a sentence: ""The hotel where we stayed during the vacation was very luxurious and comfortable."""
el permiso de conducir,driver’s license,"Claro, aquí tienes una frase: ""Mi hermana acaba de obtener el permiso de conducir y ahora podrá manejar por su cuenta"".","""Of course, here is a sentence: 'Mi hermana acaba de obtener el permiso de conducir y ahora podrá manejar por su cuenta'."""
echar gasolina,to get gas,"Claro, aquí tienes un ejemplo de una oración en español usando la expresión 'echar gasolina': ""Mañana tengo que parar en la gasolinera para echar gasolina antes de emprender el viaje"".","Of course, here is an example sentence in English using the expression 'echar gasolina': ""Tomorrow, I have to stop at the gas station to fill up with gas before starting the road trip.""."
viajar,to travel,"Claro, aquí tienes una oración: Me encanta viajar y explorar nuevos lugares.","Of course, here is a sentence: I love traveling and exploring new places."
volver,to return,"Por la tarde, volveré a casa para descansar.","In the evening, I will return home to rest."
ir,to go,Voy a la tienda a comprar comida para la cena.,I am going to the store to buy food for dinner.
salir,to leave,"Claro, aquí tienes: ""Vamos a salir a comer pizza esta noche.""","""Of course, here you go: 'We are going out to eat pizza tonight.'"""
parar,to stop,No puedo parar de reírme viendo esa comedia.,I can't stop laughing while watching that comedy.
partir,to depart,Clara va a partir temprano mañana para llegar a tiempo a la reunión.,"Sure, here is the sentence: ""Clara is going to leave early tomorrow to arrive on time for the meeting."""
porter(a),doorman,La portería del equipo de fútbol está impecable para el próximo partido.,The soccer team's goal post is immaculate for the next match.
hostia,hostess,"Sure, here is a sentence for you: ""El pan de este restaurante es una hostia, ¡es increíble!""","Sure, here is a sentence for you: ""The bread from this restaurant is amazing, it's incredible!"""
botones,bellhop,Los botones de la camisa están todos desabrochados.,The buttons of the shirt are all unbuttoned.
