Spanish word,English word,Spanish Sentence,English Sentence
anfitriona,airline hostess,La anfitriona preparó una deliciosa cena para sus invitados.,"""The hostess prepared a delicious dinner for her guests."""
el avión,airplane,El avión despegó del aeropuerto rumbo a su destino.,The airplane took off from the airport headed to its destination.
el coche,car,El coche rojo está aparcado en la calle.,The red car is parked on the street.
la bicicleta,bicycle,Clara montó en la bicicleta para dar un paseo por el parque.,Clara got on the bicycle to take a ride through the park.
la motocicleta,motorcycle,Clara compró una motocicleta nueva esta mañana.,Clara bought a new motorcycle this morning.
el tren,train,"Me encanta viajar en el tren, es una experiencia muy relajante.","""I love traveling by train, it's a very relaxing experience."""
el metro/subte,subway,"Claro, aquí tienes una frase: ""Voy a tomar el metro para ir al centro de la ciudad.""","Claro, here is a sentence: ""I am going to take the subway to go to the city center."""
el autobús,bus,Tomaré el autobús para ir al centro.,"""I will take the bus to go downtown."""
el barco,ship,El barco zarpará mañana hacia Puerto Rico.,"""The ship will set sail tomorrow for Puerto Rico."""
taxista,taxi driver,El taxista nos llevó al aeropuerto rápidamente.,The taxi driver took us to the airport quickly.
revisor(a),train conductor,El revisor de la obra literaria encontró varios errores ortográficos.,The literary work reviewer found several spelling errors.
dependiente de gas,gas station attendant,El calentador de agua es dependiente de gas para funcionar correctamente.,The water heater is gas-powered and relies on gas to function properly.
conductor(a),"driver, chauffeur",El conductor del autobús nos llevó de manera segura a nuestro destino.,"""The bus driver took us safely to our destination."""
camionero(a),truck driver,El camionero entregó la carga a tiempo.,"""The truck driver delivered the cargo on time."""
el sol,the sun,"Claramente, el sol brilla con fuerza en el cielo despejado de verano.","Clearing, the sun shines brightly in the clear summer sky."
las nubes,the clouds,Las nubes cubren el cielo en un día nublado.,"""The clouds cover the sky on a cloudy day."""
la niebla,the fog,"""La niebla cubría el paisaje, dándole un aire misterioso y mágico.""","""The fog covered the landscape, giving it a mysterious and magical atmosphere."""
la neblina,the mist,"Por la mañana, la neblina cubre el paisaje creando un ambiente misterioso y tranquilo.","In the morning, the mist covers the landscape creating a mysterious and tranquil atmosphere."
la lluvia,the rain,"Claro, aquí tienes una frase: ""Me encanta escuchar el sonido de la lluvia caer en las noches de verano"".","Of course, here is a sentence: ""I love listening to the sound of the rain falling on summer nights."""
la llovizna,the drizzle,"Salió de casa con su paraguas por si empezaba a llover, pero solo se encontró con la llovizna.","She left home with her umbrella in case it started raining, but she only encountered a drizzle."
la tormenta,the storm,¡La tormenta fue muy fuerte ayer por la noche!,The storm was very strong last night!
el tornado,the tornado,¡El tornado causó gran destrucción en la ciudad!,"¡El tornado causó gran destrucción en la ciudad, dejando a muchas familias sin hogar!"
el trueno,the thunder,El trueno retumbó tan fuerte que hizo temblar las ventanas de la casa.,The thunder rumbled so loudly that it made the windows of the house shake.
el relámpago,the lightning strike,"Durante la tormenta, el relámpago iluminaba el cielo con su luz brillante.","During the storm, the lightning illuminated the sky with its bright light."
el rayo,the lightning bolt,El rayo iluminó el cielo durante la tormenta.,"""The lightning illuminated the sky during the storm."""
el viento,the wind,El viento sopla suavemente a través de los árboles.,"""The wind gently blows through the trees."""
la brisa,the breeze,Disfruté de la suave brisa marina mientras caminaba por la playa.,I enjoyed the gentle sea breeze while walking along the beach.
el granizo,the hail,El granizo dañó los cultivos en el campo.,The hail damaged the crops in the field.
el hielo,the ice,El hielo es frío y transparente.,The ice is cold and transparent.
la nieve,the snow,"Durante el invierno, me gusta jugar en la nieve con mis amigos.","During the winter, I enjoy playing in the snow with my friends."
el calor,the heat,"En verano, el calor puede ser insoportable en algunas regiones.","En verano, el calor puede ser insoportable en algunas regiones, haciendo que sea difícil disfrutar de actividades al aire libre."
el frío,the cold,Me gusta abrigarme bien cuando hace el frío.,"""I like to bundle up warmly when it's cold."""
la humedad,the humidity,"""La humedad en el ambiente está causando que la ropa tarde más en secarse.""","""The humidity in the air is causing the clothes to take longer to dry."""
la temperatura,the temperature,La temperatura está subiendo en el transcurso del día.,The temperature is rising throughout the day.
el pronóstico,the forecast,El pronóstico del tiempo para mañana es soleado y caluroso.,The weather forecast for tomorrow is sunny and hot.
llover,to rain,"Claro, aquí tienes: ""Ayer comenzó a llover inesperadamente mientras estábamos de paseo.""","Of course, here you go: ""Yesterday it unexpectedly started raining while we were out for a walk."""
lloviznar,to drizzle,Hoy va a lloviznar por la tarde en la ciudad.,Today it is going to drizzle in the city in the afternoon.
diluviar,to pour down,Hoy está pronosticado que va a diluviar en la ciudad.,Today it is forecasted that it is going to pour in the city.
granizar,to hail,¡Ayer granizó mucho en mi ciudad y dejó el suelo completamente blanco!,Yesterday it hailed a lot in my city and left the ground completely white!
nevar,to snow,Hoy está nevando mucho en la montaña.,Today it's snowing heavily in the mountains.
el invierno,winter,"En el invierno, me gusta quedarme en casa con una taza de chocolate caliente.","In winter, I like to stay at home with a cup of hot chocolate."
la primavera,spring,"Claro, aquí tienes una oración: ""Me encanta salir a disfrutar de la naturaleza durante la primavera.""","Of course, here is a sentence: ""I love going out to enjoy nature during the spring."""
el verano,summer,Disfruto del sol y la playa durante el verano.,I enjoy the sun and the beach during the summer.
el otoño,fall,"En el otoño, las hojas de los árboles cambian de color y caen al suelo.","In the fall, the leaves of the trees change color and fall to the ground."
carta de motivación,cover letter,La carta de motivación es fundamental para destacar tus habilidades y experiencias en una solicitud de empleo.,The cover letter is essential to highlight your skills and experiences in a job application.
el cv,resume,El cv es un documento importante para presentar tus habilidades y experiencia laboral a posibles empleadores.,"""The resume is an important document to showcase your skills and work experience to potential employers."""
la firma,firm,"Claro, aquí tienes una oración: ""Antes de enviar el contrato, asegúrate de que la firma esté completa"".","""Make sure the signature is complete before sending the contract."""
el negocio,business,"Claro, aquí tienes: ""El negocio de mi abuelo ha estado en la familia por generaciones"".","""Sure, here you go: 'My grandfather's business has been in the family for generations.'"""
la compañía,company,Me encanta trabajar en la compañía de mis amigos.,I love working at the company with my friends.
el jefe,boss,El jefe me dio una tarea importante para completar hoy.,"""The boss gave me an important task to complete today."""
el empleado,employee,El empleado es muy trabajador y amable con los clientes.,The employee is very hardworking and friendly with the customers.
trabajar,to work,"Claro, aquí tienes una oración en español usando la palabra 'trabajar': ""Me gusta trabajar en equipo para lograr nuestros objetivos"".","Of course, here is a sentence in English using the word 'work': ""I enjoy working as a team to achieve our goals.""."
negociar,to negotiate,Vamos a negociar los términos del contrato mañana.,Let's negotiate the terms of the contract tomorrow.
consultor(a),consultant,El consultor financiero ayudó a la empresa a mejorar sus estrategias de inversión.,"""The financial consultant helped the company improve its investment strategies."""
dueño(a),owner,El dueño del restaurante es muy amable con sus clientes.,The restaurant owner is very kind to his customers.
abogado(a),lawyer,El abogado presentó un caso sólido en el juicio.,"""The lawyer presented a solid case in court."""
arquitecto(a),architect,El arquitecto diseñó un hermoso edificio moderno.,The architect designed a beautiful modern building.
bombero(a),fireman,El bombero apagó el incendio rápidamente.,The firefighter quickly put out the fire.
campesino(a),farm worker,El campesino cultivaba la tierra con sus propias manos.,The peasant cultivated the land with his own hands.
carpintero(a),carpenter,El carpintero está construyendo una nueva mesa para la cocina.,"""The carpenter is building a new table for the kitchen."""
cartero(a),postal worker,El cartero entregó las cartas en el vecindario.,The mailman delivered the letters in the neighborhood.
casero(a),landlord,La sopa casera de mi abuela es la mejor que he probado.,"""The homemade soup from my grandmother is the best I have ever tasted."""
científico(a),scientist,El investigador es reconocido por su labor científica en el campo de la biología.,The researcher is recognized for his scientific work in the field of biology.
cocinero(a),"cook, chef",El cocinero preparó un delicioso platillo para la cena.,The chef prepared a delicious dish for dinner.
consejero (a),counselor,El consejero escolar ayuda a los estudiantes a resolver sus problemas emocionales.,The school counselor helps students solve their emotional problems.
constructor (a),construction worker,El constructor estaba supervisando la obra de construcción.,The builder was supervising the construction site.
contador(a),accountant/bookkeeper,El contador revisó los registros financieros de la empresa.,The accountant reviewed the company's financial records.
doméstico(a),maid,El gato es un animal doméstico muy cariñoso.,"Sure! Here is a sentence in English using the translated phrase ""The cat is a very affectionate domestic animal."": ""I love coming home to my cat because she is a very affectionate domestic animal."""
detective,detective,El detective investigó el misterioso caso hasta encontrar al culpable.,The detective investigated the mysterious case until finding the culprit.
"director, revisor, redactor(a)",editor,El director revisó el trabajo del redactor para asegurarse de que estaba correcto.,The director reviewed the writer's work to ensure it was correct.
electricista,electrician,El electricista instaló nuevos enchufes en la cocina.,The electrician installed new outlets in the kitchen.
escritor / autor(a),writer / author,El escritor escribió una novela muy interesante.,The writer wrote a very interesting novel.
"vaquero, tropero(a)",cowboy,El vaquero y la tropera cabalgaban juntos por las praderas del oeste.,"""The cowboy and the cowgirl rode together through the western meadows."""
manejador(a),manager,El manejador del restaurante supervisa el desempeño de los empleados.,The restaurant manager supervises the performance of the employees.
granjero(a),farmer,El granjero cuida de sus animales todos los días.,The farmer takes care of his animals every day.
ingeniero(a),engineer,Clara es una ingeniera eléctrica muy talentosa.,Clara is a very talented electrical engineer.
jardinero(a),gardener,El jardinero está plantando flores en el jardín.,The gardener is planting flowers in the garden.
jefe,boss,El jefe de la empresa está planeando una reunión importante.,The boss of the company is planning an important meeting.
juez,judge,El juez dictó sentencia a favor del demandante en el juicio.,The judge ruled in favor of the plaintiff in the trial.
lavandero(a),laundry person,La lavandera está lavando la ropa en el río.,The washerwoman is washing the clothes in the river.
marinero(a),merchant marine,El marinero navegaba con valentía en alta mar.,The sailor navigated bravely in the high seas.
mecánico (a),mechanic,El mecánico arregló mi coche esta mañana.,The mechanic fixed my car this morning.
camarero(a),waiter,El camarero me sirvió una deliciosa comida en el restaurante.,The waiter served me a delicious meal at the restaurant.
padre,priest,Mi padre es muy trabajador y cariñoso.,"""My father is very hardworking and affectionate."""
panadero(a),baker,El panadero hornea pan fresco cada mañana en la panadería.,The baker bakes fresh bread every morning at the bakery.
pastor(a),pastor/minister,La pastora cuida a las ovejas en el campo.,"""The shepherdess takes care of the sheep in the field."""
periodista,reporter/journalist,El periodista cubrió la noticia en vivo desde la escena del crimen.,The journalist covered the news live from the crime scene.
pescador(a),fisherman,¡El pescador atrapó un pez muy grande en el río!,The fisherman caught a very big fish in the river!
pintor(a),painter,El pintor está creando una obra maestra en su estudio.,The painter is creating a masterpiece in his studio.
plomero(a),plumber,El plomero arregló la tubería en mi casa ayer.,The plumber fixed the pipe in my house yesterday.
Policía,policeman,La policía detuvo al ladrón en el centro comercial.,The police arrested the thief at the shopping mall.
programador(a),computer programmer,El programador creó un nuevo software muy avanzado.,The programmer created a very advanced new software.
dueño(a),owner,El dueño del restaurante fue muy amable con los clientes.,The restaurant owner was very kind to the customers.
químico(a),chemist,La investigadora está realizando pruebas químicas en el laboratorio.,The researcher is conducting chemical tests in the laboratory.
ranchero(a),rancher,Ayer fuimos a comer a un restaurante mexicano y pedí tacos rancheros.,Yesterday we went to eat at a Mexican restaurant and I ordered rancheros tacos.
rebuscador(a),researcher,El chef era un rebuscador de ingredientes exóticos para sus platillos.,The chef was a seeker of exotic ingredients for his dishes.
reparador(a),repairman,El técnico reparador arregló la lavadora en poco tiempo.,"""The repair technician fixed the washing machine in no time."""
técnico(a) de laboratorio,lab technician,El técnico de laboratorio realizó pruebas clínicas para diagnosticar la enfermedad.,The laboratory technician conducted clinical tests to diagnose the illness.
trabajador(a) de fábrica,factory worker,El trabajador de fábrica lleva años dedicado a su labor con esfuerzo y dedicación.,The factory worker has been dedicated to his work with effort and dedication for years.
veterinario(a),veterinarian,El veterinario salvó la vida de mi perrito enfermo.,"""The veterinarian saved the life of my sick little dog."""
ir al gimnasio,go to the gym,"Claro, aquí tienes: ""Mañana voy a ir al gimnasio para hacer ejercicio"".","Of course, here you go: ""Tomorrow I am going to the gym to exercise."""
ir de caminata,go hiking,Vamos a ir de caminata por el bosque este fin de semana.,"""Let's go for a hike in the forest this weekend."""
levantar pesas,lift weight,"Por las mañanas, me gusta levantar pesas en el gimnasio para mantenerme en forma.","In the mornings, I like to lift weights at the gym to stay in shape."
mantenerse en forma,to stay in shape,Es importante mantenerse en forma para tener una vida saludable.,It is important to stay in shape in order to have a healthy life.
practicar,to practice,Me gusta practicar el piano todos los días.,I like to practice the piano every day.
nadar,to swim,A mí me gusta nadar en el mar durante el verano.,A mí me gusta nadar en el mar durante el verano porque es refrescante y relajante.
el yoga,yoga,Practicar el yoga me ayuda a relajarme y mantener la calma.,Practicing yoga helps me relax and stay calm.
el fútbol,soccer,A mi hermano le encanta jugar al fútbol los fines de semana con sus amigos.,My brother loves playing soccer on the weekends with his friends.
el fútbol americano,football,A muchos estadounidenses les encanta ver el fútbol americano los domingos por la tarde.,Many Americans love to watch American football on Sunday afternoons.
el béisbol,baseball,A mi papá le encanta ver el béisbol los domingos por la tarde.,My dad loves to watch baseball on Sunday afternoons.
el baloncesto,basketball,A mí me gusta jugar el baloncesto con mis amigos los fines de semana.,"""A mí me gusta jugar el baloncesto con mis amigos los fines de semana porque es una divertida forma de pasar el tiempo juntos""."
el golf,golf,A Juan le gusta jugar al golf los fines de semana con sus amigos.,Juan enjoys playing golf on the weekends with his friends.
el hockey,hockey,A mí me encanta ver el hockey en la televisión.,"Sure! Here is a sentence using the phrase 'A mí me encanta ver el hockey en la televisión.': 

A mí me encanta ver el hockey en la televisión porque me emociona ver a los jugadores en acción."
el tenis,tennis,¿Jugaste el tenis con tus amigos este fin de semana?,"""Did you play tennis with your friends this weekend?"""
el voleibol,volleyball,Me gusta jugar el voleibol en la playa con mis amigos los fines de semana.,I like playing volleyball on the beach with my friends on the weekends.
luchar,to wrestle/to fight,Voy a luchar por mis sueños hasta alcanzarlos.,"""I am going to fight for my dreams until I achieve them."""
correr,to run,El perro corre rápido por el parque.,The dog runs quickly through the park.
esquiar,to ski,Me encanta esquiar en las montañas durante el invierno.,I love skiing in the mountains during the winter.
el partido,game/match,Voy a ir al estadio para ver el partido de fútbol esta noche.,I am going to the stadium to watch the soccer game tonight.
la carrera,race,¡Ella está estudiando para su próxima carrera universitaria!,She is studying for her next university degree!
el torneo,tournament,El torneo de tenis comenzará la próxima semana en el club local.,"Sure! Here's a sentence for you: ""I can't wait for the tennis tournament to start next week at the local club."""
patear,to kick,El niño iba pateando una pelota por el parque.,The boy was kicking a ball through the park.
saltar,to jump,¡Voy a saltar por encima de la cuerda en el parque!,I am going to jump over the rope at the park!
parar,to stop/to block,A veces es necesario parar un momento y reflexionar sobre nuestras decisiones.,At times it is necessary to stop for a moment and reflect on our decisions.
balancear,to swing,El trapecista logró balancear su cuerpo con destreza y gracia durante toda la actuación.,The trapeze artist managed to balance his body with skill and grace throughout the performance.
servir,to serve,"Claro, aquí tienes: ""El camarero está listo para servir la comida a los clientes"".","Of course, here you go: ""The waiter is ready to serve the food to the customers.""."
rematar,to spike,"Mi hermano mayor iba a rematar la jugada con un gol, pero el portero rival lo evitó con una gran parada.","My older brother was about to finish the play with a goal, but the opposing goalkeeper prevented it with a great save."
pegar,to hit,Voy a pegar las fotos en el álbum de recuerdos.,I am going to stick the photos in the memory album.
driblar,to dribble,El jugador logró driblar a dos defensores y anotar un gol impresionante.,The player managed to dribble past two defenders and score an impressive goal.
tirar,to throw,Voy a tirar la basura antes de que empiece a oler mal.,I am going to take out the trash before it starts to smell bad.
agarrar,to catch,"¡No olvides agarrar tu paraguas antes de salir, está lloviendo!","""Don't forget to grab your umbrella before heading out, it's raining!"""
ganar,to win,¡Espero que mi equipo favorito gane el partido de fútbol esta noche!,I hope that my favorite team wins the soccer match tonight!
perder,to lose,"No debes perder la esperanza, siempre hay una solución.","""You should not lose hope, there is always a solution."""
empatar,to tie,"Claro, aquí tienes una oración: El partido de fútbol terminó en un empate entre los equipos rivales.","Of course, here is a sentence: The soccer match ended in a tie between the rival teams."
caminar,to walk,Prefiero caminar por el parque en lugar de usar el coche.,"""Prefiero caminar por el parque en lugar de usar el coche para disfrutar del aire fresco y la naturaleza."""
bailar,to dance,A mí me encanta bailar salsa los fines de semana.,"""Me encanta bailar salsa los fines de semana porque es una forma divertida y emocionante de pasar el tiempo libre."""
jugar,to play,Me gusta jugar al fútbol los fines de semana con mis amigos.,I like to play soccer on the weekends with my friends.
competir,to compete,Los atletas están listos para competir en la carrera de relevos.,The athletes are ready to compete in the relay race.
These common Spanish words for food will leave you hungry for more Spanish!,,Estas palabras comunes en español para la comida te dejarán con hambre de más español.,These common words in Spanish for food will leave you craving more Spanish.
la comida,food,¡Me encanta la comida mexicana!,I love Mexican food!
las bebidas,drinks,"""En la fiesta, serviremos las bebidas refrescantes para nuestros invitados.""","""At the party, we will serve refreshing drinks to our guests."""
las verduras,vegetables,Mi mamá compró las verduras frescas en el mercado.,My mom bought fresh vegetables at the market.
las frutas,fruits,Las frutas son una excelente fuente de vitaminas y minerales para mantener una dieta equilibrada.,Fruits are an excellent source of vitamins and minerals to maintain a balanced diet.
cocinar,to cook,Voy a cocinar una deliciosa cena esta noche.,I am going to cook a delicious dinner tonight.
tengo hambre,i’m hungry,"Claro, aquí tienes una frase en español: ""Después de tanto ejercicio, ¡tengo hambre!""","Of course, here is a sentence in English: ""After so much exercise, I'm hungry!"""
tengo sed,i’m thirsty,"Claro. Aquí tienes una frase: ""Después de correr tanto, tengo sed y necesito beber agua.""","Claro. Here is a sentence: ""After running so much, I'm thirsty and need to drink water."""
la res,beef,La res es un animal doméstico que se cría comúnmente para la producción de carne y leche.,The goat is a domestic animal that is commonly raised for the production of meat and milk.
el pollo,chicken,"Claro, aquí tienes: ""Me encanta comer el pollo asado los domingos en familia.""","Of course, here you go: ""I love eating roast chicken on Sundays with my family."""
la gallina,chicken,La gallina canta al amanecer todos los días.,"""The hen crows at dawn every day."""
el cordero,lamb,El cordero fue cocinado lentamente en el horno con hierbas y especias.,The lamb was cooked slowly in the oven with herbs and spices.
la barbacoa,grilled,Me encanta cocinar la barbacoa en el jardín los domingos por la tarde.,I love to cook barbecue in the garden on Sunday afternoons.
el cerdo,pork,El granjero alimentó al cerdo antes de irse a dormir.,The farmer fed the pig before going to bed.
el perrito caliente,hot dog,Me gusta comer el perrito caliente con mostaza y ketchup.,"""I like to eat the hot dog with mustard and ketchup."""
el jamón,ham,"""Me encanta el jamón serrano en mi bocadillo favorito.""",I love Serrano ham in my favorite sandwich.
la hamburguesa,hamburger,Me encanta la hamburguesa con queso y aguacate.,"""I love the cheese and avocado hamburger."""
el tocino,bacon,El tocino se cocina en la sartén hasta que esté dorado y crujiente.,The bacon is cooked in the pan until it is golden and crispy.
el pescado,fish,¡Ayer preparé un delicioso plato de el pescado al horno con limón y hierbas!,Yesterday I prepared a delicious baked fish dish with lemon and herbs!
la zanahoria,carrot,¡Me encanta la zanahoria en mi ensalada!,I love having carrots in my salad!
la lechuga,lettuce,"Claro, aquí tienes: Me gusta poner la lechuga en las ensaladas.","Of course, here you go: I like to put lettuce in salads."
el tomate,tomato,El tomate es una fruta muy versátil que se utiliza en muchas recetas.,Tomato is a very versatile fruit that is used in many recipes.
la maíz,corn,El maíz es un alimento básico en la dieta de muchos países latinoamericanos.,"""Maize is a staple food in the diet of many Latin American countries."""
la papa,potato,¡Me encanta cocinar la papa al horno con mantequilla y romero!,I love cooking baked potatoes with butter and rosemary!
la patata,potato,"Claro, aquí tienes una oración: ""Me encanta la patata frita con salsa de queso"".","Of course, here is a sentence: ""I love French fries with cheese sauce.""."
las papas,french fries,Me gusta comer las papas fritas con salsa de tomate.,"""I like to eat French fries with ketchup."""
las patatas fritas,french fries,Me encantan las patatas fritas con salsa picante.,I love French fries with spicy sauce.
el brocoli,broccoli,¡Me encanta comer el brócoli en ensaladas!,I love eating broccoli in salads!
la espinaca,spinach,¡Me encanta la espinaca en mis ensaladas!,I love spinach in my salads!
la cebolla,onion,Me gusta cocinar con la cebolla porque le da mucho sabor a mis platillos.,I enjoy cooking with onions because they add a lot of flavor to my dishes.
la col,cabbage,La col es una verdura deliciosa y nutritiva que se puede cocinar de diversas formas.,Broccoli is a delicious and nutritious vegetable that can be cooked in various ways.
la ensalada,salad,Me encanta comer la ensalada con aguacate y tomate todos los días.,I love eating salad with avocado and tomato every day.
